{
  "schemaVersion": 1,
  "publisher": {
    "id": "leolas-library-publishing",
    "name": "Leola's Library Publishing House",
    "model": "curated-display-and-author-support",
    "sellerOfRecord": false
  },
  "policies": {
    "pricing": "Authors/publishers control their listed price and external purchase destination. Leola's Library displays approved listings and does not claim to be seller of record unless a future commerce agreement explicitly says otherwise.",
    "premieres": "premiereRank controls the current 3D showcase. Set premiere=false to return a title to the general catalog.",
    "removal": "A title can be removed from display by setting status to withdrawn without modifying the 3D world."
  },
  "books": [
    {
      "id": "needle-and-yarn",
      "slug": "needle-and-yarn",
      "title": "Needle & Yarn",
      "subtitle": "A Love Stitched in Time",
      "author": {
        "name": "Leola “Sista” Lee"
      },
      "edition": "Illustrated edition from creator-supplied final PDF",
      "format": "ebook",
      "status": "published",
      "featured": true,
      "premiere": true,
      "premiereRank": 1,
      "cover": {
        "front": "assets/books/needle-and-yarn/cover.jpg",
        "back": null,
        "spine": null
      },
      "content": {
        "type": "illustrated-pages",
        "source": "content/needle-and-yarn-illustrated.json",
        "chapterCount": 6,
        "pageCount": 33,
        "epub": "assets/books/needle-and-yarn/needle-and-yarn.epub"
      },
      "commerce": {
        "currency": "USD",
        "price": null,
        "purchaseUrl": null,
        "priceLabel": "Price coming soon"
      },
      "rights": {
        "displayApproved": true,
        "readApproved": true
      }
    },
    {
      "id": "crochet-mastery",
      "slug": "crochet-mastery",
      "title": "Crochet Mastery",
      "subtitle": "A Complete Guide",
      "author": {
        "name": "Leola (Sister) Lee"
      },
      "edition": "Digital learning edition",
      "format": "ebook",
      "status": "published",
      "featured": true,
      "premiere": true,
      "premiereRank": 2,
      "cover": {
        "front": "jva31043ou.png",
        "back": null,
        "spine": null
      },
      "content": {
        "type": "chapter-json",
        "source": "content/crochet-mastery-chapters.json",
        "chapterCount": 6
      },
      "commerce": {
        "currency": "USD",
        "price": null,
        "purchaseUrl": null,
        "priceLabel": "Price coming soon"
      },
      "rights": {
        "displayApproved": true,
        "readApproved": true
      }
    }
  ]
}
